{
  "statement_version": "statement-v2-research-draft",
  "semantic_scope": "one_step_transformer_onnx_equivalence_under_fixed_profile",
  "fixed_point_profile": "i16-state-f32-carrier-round-nearest-v1",
  "onnx_op_subset_version": "onnx-op-subset-v2",
  "onnx_op_subset_size": 12,
  "program_path": "programs/gemma_block_v3.tvm",
  "checked_steps": 1,
  "instruction": "LOAD 0",
  "layer_idx": 0,
  "matched": true,
  "state_before": {
    "pc": 0,
    "acc": 0,
    "sp": 17,
    "zero_flag": true,
    "carry_flag": false,
    "halted": false,
    "memory": [
      1,
      1,
      2,
      0,
      0,
      2,
      2,
      -4,
      0,
      2,
      0,
      0,
      0,
      0,
      0,
      0,
      0
    ]
  },
  "transformer_state_after": {
    "pc": 1,
    "acc": 1,
    "sp": 17,
    "zero_flag": false,
    "carry_flag": false,
    "halted": false,
    "memory": [
      1,
      1,
      2,
      0,
      0,
      2,
      2,
      -4,
      0,
      2,
      0,
      0,
      0,
      0,
      0,
      0,
      0
    ]
  },
  "onnx_state_after": {
    "pc": 1,
    "acc": 1,
    "sp": 17,
    "zero_flag": false,
    "carry_flag": false,
    "halted": false,
    "memory": [
      1,
      1,
      2,
      0,
      0,
      2,
      2,
      -4,
      0,
      2,
      0,
      0,
      0,
      0,
      0,
      0,
      0
    ]
  },
  "commitments": {
    "hash_function": "blake2b-256",
    "statement_spec_hash": "a15276d11cdd7882b18f75735b7a2532aaab089ec3acfec1d5065e19d9a769c6",
    "fixed_point_spec_hash": "d53ffb71f333b83734185104d552f94efa4c2cbdbb940a9e99ba87b335538c36",
    "onnx_op_subset_hash": "b066e0fa17b54878d67e5ecc60f0ecc504f048788eb927019c9ad9b358a49c2c",
    "artifact_schema_hash": "22c9533ae1d5a4e6956fb3d8c9e4ca555ab13cffcad62bc32819bc43217eb303",
    "program_hash": "404a11be6ffc8d57c625bfad9dec8e76339c503fce3e056d5aa2bf1bdbab8c74",
    "transformer_config_hash": "fbe40fe16b2109797612ad942d35af86951574c44540169334a96472555c55b8",
    "onnx_metadata_hash": "ec90bb5cc3c952574cbf575ff437645ad67c71829137217b4d82bc07af9c95b6",
    "state_before_hash": "fc330be840eb4fc34843d12c6fc522ebea38957bd0921d2999b6e9f46d3eb2a2",
    "transformer_state_after_hash": "3ec54e64c27d4b2505591f9dd4013f436866c7e38f00aa1bb02551761ca5daed",
    "onnx_state_after_hash": "3ec54e64c27d4b2505591f9dd4013f436866c7e38f00aa1bb02551761ca5daed"
  }
}